{
  "system_configurations": {
    "name": "RCCL-Tests-NET-IB-Transport",
    "description": "Comprehensive InfiniBand transport test config. Runs all NetIbMPITest tests including plugin API, physical device, and virtual device (vNIC) tests."
  },
  "paths": {
    "workdir": "${WORKDIR:-$PWD}",
    "rocm_path": "${ROCM_PATH:-/opt/rocm}",
    "mpi_path": "${MPI_PATH}"
  },
  "auto_detect_hosts": true,
  "mpi_args": {
    "mellanox": "--mca oob_tcp_if_include eth1 --mca btl_tcp_if_include eth1 --mca btl ^vader,openib --bind-to none",
    "ainic": "--mca oob_tcp_if_include eno0 --mca btl_tcp_if_include eno0 --mca btl ^vader,openib --bind-to none",
    "thor2": "--oversubscribe --mca plm_rsh_agent srun --mca oob_tcp_if_include eno8303 --mca btl_tcp_if_include eno8303 --mca btl ^openib --bind-to none"
  },
  "env_variables": {
    "NCCL_DEBUG": "INFO"
  },
  "system_env_variables": {
    "mellanox": {
      "HSA_NO_SCRATCH_RECLAIM": "1",
      "NCCL_SOCKET_IFNAME": "eth0,eth1",
      "NCCL_IB_HCA": "mlx_5_5,mlx_5_7,mlx5_2,mlx_5_1,mlx_5_7",
      "NCCL_NET_FORCE_MERGE": "mlx5_0,mlx5_1;mlx5_5,mlx5_6"
    },
    "ainic": {
      "NCCL_SOCKET_IFNAME": "eno0",
      "NCCL_IB_HCA": "rdma0,rdma1,rdma2,rdma3",
      "NCCL_NET_FORCE_MERGE": "rdma0,rdma1;rdma2,rdma3"
    },
    "thor2": {
      "NCCL_SOCKET_IFNAME": "eno8303",
      "NCCL_IB_HCA": "bnxt_re0,bnxt_re1,bnxt_re5,bnxt_re6",
      "NCCL_NET_FORCE_MERGE": "bnxt_re0,bnxt_re1;bnxt_re5,bnxt_re6"
    }
  },
  "build_configuration": {
    "install_flags": ["--debug", "-t", "-l", "--log-trace", "--enable-code-coverage", "--enable-mpi-tests", "--no_clean"],
    "cmake_options": "-DCMAKE_EXPORT_COMPILE_COMMANDS=ON",
    "parallel_jobs": 64
  },
  "test_configurations": {
    "default": {
      "env_variables": {
        "NCCL_LAUNCH_MODE": "GROUP"
      }
    },

    "socket_poll_bootstrap": {
      "is_gtest": true,
      "binary": "rccl-UnitTestsFixturesDebug",
      "num_ranks": 1,
      "num_nodes": 1,
      "num_gpus": 1,
      "timeout": 120,
      "description": "Bootstrap socket busy-loop regression. Validates that NCCL_SOCKET_POLL_TIMEOUT_MSEC makes a blocked bootstrap socket recv wait in poll() instead of pinning a CPU core at 100%. Single node, no NIC/GPU required.",
      "tests": [
        {
          "name": "Socket_BootstrapPollNoBusyLoop",
          "description": "With NCCL_SOCKET_POLL_TIMEOUT_MSEC set, a receiver blocked on a slow peer sleeps in poll() (low CPU); the control case with the param at 0 reproduces the pre-fix busy loop (high CPU).",
          "test_filter": "SocketPollTimeout.*"
        }
      ]
    },

    "net_ib_base": {
      "extends": "default",
      "is_gtest": true,
      "binary": "rccl-UnitTestsMPI",
      "num_ranks": 2,
      "num_nodes": 2,
      "num_gpus": 1,
      "env_variables": {
        "NCCL_IB_MERGE_NICS": "1",
        "NCCL_IB_MERGE_VFS": "1",
        "NCCL_DMABUF_ENABLE": "1"
      }
    },

    "net_ib_gdr_flush": {
      "extends": "net_ib_base",
      "num_ranks": 2,
      "num_nodes": 1,
      "num_gpus": 2,
      "timeout": 120,
      "env_variables": {
        "NCCL_CUMEM_ENABLE": "1"
      },
      "tests": [
        {
          "name": "GdrFlush_CuMemDmaBuf_NoAsyncFatal",
          "description": "Whitebox ncclIbIflush over a dma-buf (cuMem/UBR) RO=0 flush scratchpad - the exact path that used to raise the mlx5 'invalid request local work queue error'. The read-only flush (RDMA_READ fence, WRITE removed) must complete cleanly with correct data.",
          "test_filter": "GdrFlushTest.CuMemDmaBuf_GpuRecvFlush_NoAsyncFatal"
        },
        {
          "name": "GdrFlush_Peermem_NoAsyncFatal",
          "description": "Whitebox ncclIbIflush over a legacy peermem (ibv_reg_mr) RO=0 scratchpad. Confirms the fix keeps the peermem read path working (never regressed).",
          "test_filter": "GdrFlushTest.Peermem_GpuRecvFlush_NoAsyncFatal",
          "env_variables": {
            "NCCL_CUMEM_ENABLE": "0"
          }
        },
        {
          "name": "GdrFlush_FeatureDisabled_Fallback",
          "description": "Whitebox ncclIbIflush fallback branch: with the dedicated RO=0 scratchpad disabled it reads the received buffer directly (upstream-NCCL behaviour).",
          "test_filter": "GdrFlushTest.FeatureDisabled_FallbackReadRecvBuffer",
          "env_variables": {
            "RCCL_GDR_FLUSH_GPU_MEM_NO_RELAXED_ORDERING": "0"
          }
        },
        {
          "name": "GdrFlush_RepeatedFlushBurst",
          "description": "50-iteration GPU recv+flush burst over the dma-buf scratchpad; an intermittent QP async-fatal would surface as a non-success flush. The whole burst must stay clean.",
          "test_filter": "GdrFlushTest.RepeatedFlush_NoFaultBurst"
        },
        {
          "name": "GdrFlush_ForcedScratchpadWrite_ReproducesFault",
          "description": "Regression guard (ENABLE_FAULT_INJECTION debug builds only): forces the removed scratchpad RDMA_WRITE back on a dma-buf buffer and asserts the flush QP faults, proving the WRITE was the culprit. Absent/skipped when fault injection is not compiled in.",
          "test_filter": "GdrFlushTest.ForcedScratchpadWrite_ReproducesFault"
        }
      ]
    },

    "net_ib_initialization": {
      "extends": "net_ib_base",
      "timeout": 60,
      "tests": [
        {
          "name": "NetIB_Init_Plugin",
          "description": "Initialize InfiniBand network plugin and verify basic setup",
          "test_filter": "NetIbMPITest.InitializePlugin"
        },
        {
          "name": "NetIB_Init_GetDeviceCount",
          "description": "Query and validate InfiniBand device count",
          "test_filter": "NetIbMPITest.GetDeviceCount"
        }
      ]
    },

    "net_ib_properties": {
      "extends": "net_ib_base",
      "timeout": 60,
      "tests": [
        {
          "name": "NetIB_Props_GetProperties",
          "description": "Query InfiniBand device properties and capabilities",
          "test_filter": "NetIbMPITest.GetDeviceProperties"
        },
        {
          "name": "NetIB_Props_InvalidDevice",
          "description": "Error handling when querying properties of invalid InfiniBand device",
          "test_filter": "NetIbMPITest.GetDevicePropertiesInvalidDevice"
        }
      ]
    },

    "net_ib_connection": {
      "extends": "net_ib_base",
      "timeout": 120,
      "tests": [
        {
          "name": "NetIB_Conn_ListenAndConnect",
          "description": "Basic listen/connect/accept handshake over IB",
          "test_filter": "NetIbMPITest.ListenAndConnect"
        },
        {
          "name": "NetIB_Conn_InvalidHandle",
          "description": "Connect with invalid handle error handling",
          "test_filter": "NetIbMPITest.ConnectWithInvalidHandle"
        },
        {
          "name": "NetIB_Conn_CloseWithoutWaiting",
          "description": "Close connection without waiting for transfer completion",
          "test_filter": "NetIbMPITest.CloseWithoutWaitingForCompletion"
        },
        {
          "name": "NetIB_Conn_MultipleSequential",
          "description": "Multiple sequential listen/connect/close cycles",
          "test_filter": "NetIbMPITest.MultipleSequentialConnections"
        },
        {
          "name": "NetIB_Conn_ListenCloseListen",
          "description": "Close listener mid-handshake and re-listen on same port",
          "test_filter": "NetIbMPITest.ListenCloseListen"
        },
        {
          "name": "NetIB_Conn_MultipleSimultaneousListens",
          "description": "Multiple concurrent listeners on different handles",
          "test_filter": "NetIbMPITest.MultipleSimultaneousListens"
        },
        {
          "name": "NetIB_Conn_RapidConnectDisconnect",
          "description": "Rapid repeated connect/disconnect cycles for resource leak detection",
          "test_filter": "NetIbMPITest.RapidConnectDisconnect"
        }
      ]
    },

    "net_ib_memory": {
      "extends": "net_ib_base",
      "timeout": 120,
      "tests": [
        {
          "name": "NetIB_Mem_RegisterHost",
          "description": "Register host memory buffers for IB RDMA",
          "test_filter": "NetIbMPITest.RegisterHostMemory"
        },
        {
          "name": "NetIB_Mem_RegisterGpu",
          "description": "Register GPU device memory buffers for IB RDMA",
          "test_filter": "NetIbMPITest.RegisterGpuMemory"
        },
        {
          "name": "NetIB_Mem_RegisterNull",
          "description": "Register NULL pointer error handling",
          "test_filter": "NetIbMPITest.RegisterMemoryNullPointer"
        },
        {
          "name": "NetIB_Mem_DeregisterNull",
          "description": "Deregister NULL handle error handling",
          "test_filter": "NetIbMPITest.DeregisterNullHandle"
        }
      ]
    },

    "net_ib_transfer": {
      "extends": "net_ib_base",
      "timeout": 300,
      "env_variables": {
        "NCCL_DEBUG": "INFO",
        "NCCL_DEBUG_SUBSYS": "NET,INIT"
      },
      "tests": [
        {
          "name": "NetIB_Xfer_SimpleSendRecv",
          "description": "Basic IB send/receive data transfer",
          "test_filter": "NetIbMPITest.SimpleSendRecv"
        },
        {
          "name": "NetIB_Xfer_MultipleSizes",
          "description": "IB data transfer with multiple buffer sizes",
          "test_filter": "NetIbMPITest.SendRecvMultipleSizes"
        },
        {
          "name": "NetIB_Xfer_ZeroSize",
          "description": "IB zero-byte send/receive",
          "test_filter": "NetIbMPITest.SendRecvZeroSize"
        },
        {
          "name": "NetIB_Xfer_LargeTransfer",
          "description": "IB large buffer data transfer",
          "test_filter": "NetIbMPITest.LargeTransfer"
        },
        {
          "name": "NetIB_Xfer_MultipleSequential",
          "description": "Multiple sequential send/recv on the same connection",
          "test_filter": "NetIbMPITest.MultipleSequentialTransfers"
        },